{
  "id": "sandbox-power",
  "version": "0.1.0",
  "title": {
    "ko": "샌드박스 파워유저",
    "en": "Sandbox Power User"
  },
  "description": {
    "ko": "샌드박스/원격 제어 세션을 자주 오가는 사용자용 — 어느 세션이 격리·원격 상태인지 상태줄에서 바로 확인",
    "en": "For users juggling sandboxed and remote-controlled sessions — see at a glance which session is isolated or remote"
  },
  "tool": "ccstatusline",
  "category": "productivity",
  "tags": [
    "sandbox",
    "remote-control",
    "power-user",
    "colors"
  ],
  "author": {
    "name": "neo",
    "github": "Brit-juho"
  },
  "ccstatusline_settings": {
    "version": 3,
    "lines": [
      [
        {
          "id": "1",
          "type": "model",
          "color": "cyan",
          "bold": true
        },
        {
          "id": "2",
          "type": "sandbox-status",
          "color": "green"
        },
        {
          "id": "3",
          "type": "remote-control-status",
          "color": "blue"
        },
        {
          "id": "4",
          "type": "worktree-mode",
          "color": "yellow"
        },
        {
          "id": "5",
          "type": "context-bar",
          "color": "green"
        },
        {
          "id": "6",
          "type": "session-cost",
          "color": "orange"
        }
      ]
    ]
  }
}
