{
  "id": "ko-productivity",
  "version": "0.1.0",
  "title": {
    "ko": "생산성 올인원",
    "en": "Productivity All-in-One"
  },
  "description": {
    "ko": "생산성 극대화를 위한 올인원 설정 — 시간, 작업 수, 토큰, Git, 비용을 모두 표시",
    "en": "All-in-one for maximum productivity — time, tasks, tokens, Git, and cost in one bar"
  },
  "tool": "ccstatusline",
  "category": "productivity",
  "tags": [
    "productivity",
    "all-in-one",
    "time",
    "tasks"
  ],
  "author": {
    "name": "neo",
    "github": "Brit-juho"
  },
  "ccstatusline_settings": {
    "version": 3,
    "lines": [
      [
        {
          "id": "1",
          "type": "session-clock",
          "color": "dim"
        },
        {
          "id": "2",
          "type": "git-status",
          "color": "blue"
        },
        {
          "id": "3",
          "type": "model",
          "color": "dim"
        },
        {
          "id": "4",
          "type": "tokens-total",
          "color": "dim"
        },
        {
          "id": "5",
          "type": "session-cost",
          "color": "green"
        }
      ]
    ]
  }
}
